ID,Name,Price_amount,Price_currency,Photo,Specs,Rating,SupplierInfo,MadeIn,ProductionCompanyName,Status,Store_ID
8cc572b1-fc09-4ed5-aed1-6cc5be3d7bdc,Intelligent Steel Keyboard,4742,EUR,https://s3.amazonaws.com/uifaces/faces/twitter/lu4sh1i/128.jpg,Beatae natus dolorum est illo. Illum asperiores et et et dolorem quasi magni cumque dolorum. Deserunt voluptatum commodi.,2,Dolorem pariatur consequatur omnis cupiditate omnis corrupti sed quas autem. Non repellendus optio magni ducimus quia non et. Suscipit consequatur ut sint sed itaque perspiciatis ut reiciendis quia.,Puerto Rico,Grant - Pagac,STORAGE,0b99cf7c-7075-42a1-b01b-a2972209e64d
82f95805-01ab-4590-8c31-b380c4a17327,Rustic Frozen Fish,9481,EUR,https://s3.amazonaws.com/uifaces/faces/twitter/belyaev_rs/128.jpg,Temporibus molestiae rerum vel saepe. Molestiae perspiciatis molestias enim enim. Officia est autem fugit. Ut est mollitia non iure. Optio consequatur id.,3,Repellendus debitis asperiores quia possimus nihil et quos rerum voluptates. Rerum quaerat libero eligendi. Commodi omnis natus accusantium. Enim aspernatur officia recusandae ut.,Cayman Islands,Bogan Group,OK,0b99cf7c-7075-42a1-b01b-a2972209e64d
7faf3c39-bb65-4187-b17e-0d30ffaf530d,Generic Soft Keyboard,5459,USD,https://s3.amazonaws.com/uifaces/faces/twitter/mahmoudmetwally/128.jpg,Sed qui aliquid quam ab. Tempora consequuntur dolorem perspiciatis expedita vel facilis quos sunt. Et consequatur ea nobis et eum dolores deserunt. Itaque error quam est repellat dolorem ut reprehenderit.,5,Officia labore ut voluptas nisi. Est tempora minima non sunt molestias animi eius. Quasi et maxime dolorem ab qui nihil aut incidunt nihil. Non beatae est. Sunt consequatur soluta. Veritatis consequatur excepturi est voluptas quia laboriosam magni quos.,Somalia,Dare Group,OK,1fd20164-0406-47f4-b6a9-a9894ba7fe04
2922338b-bba9-4052-bd75-ffc27db06d9e,Unbranded Steel Shirt,1160,USD,https://s3.amazonaws.com/uifaces/faces/twitter/mangosango/128.jpg,Enim aut assumenda aut voluptatem sit quae tempora ut. A aut praesentium voluptatem dolores autem. Pariatur explicabo minima quos repellendus. Quam et voluptate consequatur sint. Veniam sint dolorum similique. Eligendi non consequatur laboriosam.,2,Sapiente dolorem voluptas at cupiditate et cumque officia deleniti qui. Asperiores laboriosam explicabo ab aliquid quis facilis eligendi omnis maiores. Laboriosam voluptate qui temporibus quasi corporis. Labore quaerat libero perspiciatis facilis. Rerum dolorem laborum ab dicta culpa ipsa laboriosam.,Micronesia,Cartwright - Lesch,OUT_OF_STOCK,d0618af0-00f2-4fa5-9327-9a88a9a1e6fd
a30093fa-a334-414a-b401-bea4b7e9ef97,Intelligent Wooden Bike product,6073,USD,https://s3.amazonaws.com/uifaces/faces/twitter/chris_frees/128.jpg,Non tempore quis accusamus inventore ut nemo mollitia. Perspiciatis ad maxime cum voluptatum impedit. Fuga temporibus rerum voluptatum repellendus laudantium quo voluptatem aut. Autem quis autem velit atque id. Veniam ea inventore temporibus ipsum. Est suscipit maiores repellendus et voluptatibus et aspernatur.,3,Magnam ipsum magni et rerum vero. Numquam tempora molestiae vero illo voluptate explicabo iure non. Eaque at enim tenetur natus illo deleniti quas. Maiores ad velit quia perferendis excepturi.,Turkey,Wilderman - Hessel,OK,1fd20164-0406-47f4-b6a9-a9894ba7fe04
fc9166bb-62fc-4397-8be2-5d9834c153e2,Generic Steel Keyboard,9305,USD,https://s3.amazonaws.com/uifaces/faces/twitter/dorphern/128.jpg,Eum voluptate cupiditate et officiis quaerat voluptatibus sequi assumenda earum. Optio corrupti perspiciatis quo aliquid earum. Iste nihil beatae aut. Ut in adipisci velit vitae et est. Quis sint rem sed nemo expedita ut et.,3,Et quia et et ad sed autem voluptas excepturi ut. Quasi aut quia non. Nesciunt necessitatibus dolores magni qui vero praesentium ipsam qui sapiente. Necessitatibus laborum odio nemo ducimus occaecati omnis qui provident. Aperiam nihil eligendi ut et fuga. Cumque unde maxime aperiam vero dicta delectus ipsam.,Barbados,Stroman and Sons,STORAGE,1fd20164-0406-47f4-b6a9-a9894ba7fe04
0f3ef12b-b92a-4164-9d57-af16ec7c4e6b,Generic Cotton Computer,5907,USD,https://s3.amazonaws.com/uifaces/faces/twitter/bu7921/128.jpg,Pariatur natus porro aut et dolorum quasi. Ut doloremque voluptas amet quisquam. Libero ipsam et aut vel unde ut. Est dolores ut at cum facere tempora. Labore sit nesciunt veritatis dolorem nemo pariatur aut minus.,1,Ad consequatur tempore. Molestiae vitae aut quo est consequuntur eaque qui. Amet quas ad. Aut molestias dolor facere corporis et dolorum voluptates reprehenderit fugiat. Nisi dolorem aut dolorem debitis dolor libero.,Azerbaijan,Crooks - Hackett,STORAGE,d0618af0-00f2-4fa5-9327-9a88a9a1e6fd
abd459c1-5f8a-4601-8059-ecc087f2d4a1,Unbranded Steel Hat,9390,USD,https://s3.amazonaws.com/uifaces/faces/twitter/fabbrucci/128.jpg,Error tenetur ut explicabo. Quidem delectus accusantium dolorum autem. Optio laboriosam aspernatur facere voluptate. Et omnis provident eveniet et magni quam architecto repellat. Labore id possimus.,3,Et ex voluptatem omnis et recusandae et. Reprehenderit rerum aperiam. Illum est quo voluptas. Dolorem praesentium et aut odit laudantium aspernatur. Qui voluptas ut possimus doloremque corporis est. Delectus at laboriosam est architecto porro.,Puerto Rico,Nienow Inc,OUT_OF_STOCK,d0618af0-00f2-4fa5-9327-9a88a9a1e6fd
679a8855-c0a9-499e-b1bf-f6b62c594987,Unbranded Soft Gloves,7986,USD,https://s3.amazonaws.com/uifaces/faces/twitter/byrnecore/128.jpg,Laudantium cumque deserunt. Qui blanditiis mollitia itaque. Laudantium quia eum eligendi qui quo expedita et. Earum quod voluptatum cupiditate sequi libero cum placeat repellat. In at non architecto. Beatae aut deserunt excepturi nostrum ut quia.,5,Unde inventore voluptas officiis sed iure qui veritatis quidem. Nostrum et natus quam repudiandae a qui ex numquam ullam. Et sint tenetur et non sint. Ut molestias deleniti corporis. Similique adipisci quod. Quo veniam unde voluptatem explicabo repudiandae dolores sed.,Uzbekistan,Batz LLC,STORAGE,d0618af0-00f2-4fa5-9327-9a88a9a1e6fd
0c5012f1-9b87-4426-a950-2c07709f9b2b,Awesome Soft Fish,9940,USD,https://s3.amazonaws.com/uifaces/faces/twitter/her_ruu/128.jpg,Sit asperiores tempora molestias. Iusto repudiandae porro et. Cum itaque expedita sunt magnam in necessitatibus voluptas. Occaecati et molestiae.,1,Cupiditate est animi quod aperiam ad tenetur voluptatum autem. Aut harum omnis dolorem dolores ipsam occaecati neque omnis. Cum non vitae aspernatur sequi ut sed.,Turks and Caicos Islands,King, O'Hara and Pacocha,OUT_OF_STOCK,d554e720-870a-4088-9bcb-dce8aecaa047
00500ec1-5692-4580-9362-5f669c6dacba,Ergonomic Wooden Pizza,3394,EUR,https://s3.amazonaws.com/uifaces/faces/twitter/davidcazalis/128.jpg,Animi aut aperiam facere repellat. Explicabo debitis quam asperiores. Quae debitis odit quo sequi ipsam et. Repellat tenetur harum qui tenetur dignissimos qui quis.,3,Sunt expedita et. Fugit et sed qui ipsa magnam. Eius vero porro eius. Dolores et omnis. Nihil quo sit quae quidem quos esse sit itaque delectus.,Libyan Arab Jamahiriya,Stehr - Jerde,OUT_OF_STOCK,d554e720-870a-4088-9bcb-dce8aecaa047
e79abc19-963b-4153-93fa-84e8f3bf50bc,Generic Frozen Bacon,7766,EUR,https://s3.amazonaws.com/uifaces/faces/twitter/nvkznemo/128.jpg,Praesentium ad sed. Debitis asperiores placeat adipisci maiores sequi quia. At ut aliquid ut. Beatae iusto magnam occaecati est eos ad in quos inventore. Aperiam vero quis doloribus aspernatur sed qui beatae.,3,Iste molestiae et ut aspernatur fuga. Eius tempora debitis ratione quaerat accusamus qui cumque illum fugit. Ipsa natus eum pariatur sunt. Ea et quas quaerat voluptatibus soluta et. Consectetur dolorem dolorem architecto magnam fugit assumenda maxime et.,Canada,Littel Group,OK,d554e720-870a-4088-9bcb-dce8aecaa047
8fa52f79-4223-4272-9e90-4c8a8af38518,Intelligent Soft Shirt,3757,EUR,https://s3.amazonaws.com/uifaces/faces/twitter/danthms/128.jpg,Fugiat dignissimos quas quasi qui et. Sit repudiandae laboriosam. Voluptatibus aut dolorem aperiam ab sequi quo consequatur aut. Veniam id laborum et magni earum excepturi.,1,Temporibus ad quo in dolorum odit. Aut at qui. Quos eum earum consequatur iure. Libero beatae corporis laboriosam necessitatibus ut veniam. Sed qui doloribus molestiae et consequatur. Rem rerum voluptates eligendi quaerat laboriosam ducimus exercitationem est eos.,Japan,Ernser, Hermiston and Stamm,OK,d554e720-870a-4088-9bcb-dce8aecaa047
d5a4b3c0-c73e-4ce6-b9e7-d50ffffe897d,Handcrafted Rubber Ball,6377,EUR,https://s3.amazonaws.com/uifaces/faces/twitter/vlajki/128.jpg,Sequi dolorem quaerat tempora illo voluptas. Assumenda inventore tempora sed. Deleniti dolorem quam dicta repudiandae explicabo veniam. Eligendi id praesentium et minus perspiciatis placeat.,4,Ut dolor consequatur quidem autem illum illum debitis. Dolorem culpa qui. Sit velit voluptas quasi accusamus ut provident consequatur. Aut voluptatibus consequatur vel. Nisi nemo ea tenetur dolorem quas.,San Marino,Schneider LLC,OUT_OF_STOCK,d554e720-870a-4088-9bcb-dce8aecaa047
2a2cf3b2-d2b3-448b-adef-6b6c90cff996,Ergonomic Rubber Chair,7388,EUR,https://s3.amazonaws.com/uifaces/faces/twitter/christianoliff/128.jpg,Nemo maiores qui odio at hic perspiciatis optio. Amet quia laborum nesciunt. Dicta ipsa quo et inventore eligendi quidem.,1,Quo perferendis fugit et sit et reiciendis. Dicta dolor in ut maxime sed sapiente fugiat et. Et perspiciatis quos possimus fugit.,Sweden,Schneider Inc,OUT_OF_STOCK,d554e720-870a-4088-9bcb-dce8aecaa047
1810ad6e-6808-47ec-8e92-3965d3d2f375,Handmade Rubber Car,3619,EUR,https://s3.amazonaws.com/uifaces/faces/twitter/dhilipsiva/128.jpg,Error voluptatum libero. Deleniti omnis expedita laborum voluptatem perferendis adipisci. Sit ipsum fugiat illo qui officiis. Veritatis laborum et adipisci excepturi blanditiis. Voluptas voluptas et aut commodi ut sit. Animi assumenda ad modi maiores aliquid ut sit dolorem.,2,Aliquam earum door voluptas eum dolor accusantium. Voluptas sint dolores expedita aut. Omnis esse et mollitia magni at sit esse.,Mauritania,Daniel Inc,STORAGE,d554e720-870a-4088-9bcb-dce8aecaa047
e1ea3785-7ce7-4637-92c3-e006e1d80c64,Small Steel Gloves,2534,EUR,https://s3.amazonaws.com/uifaces/faces/twitter/91bilal/128.jpg,Et voluptas vitae sequi est. Vel voluptatem minus. Molestias ea aut labore autem cum est culpa earum. Sed vel iste est a. Voluptatem voluptas ducimus eius magni non id. Corporis ullam consequuntur ut inventore aut.,3,Et minus non error qui. Quo iste exercitationem ut corrupti non. Reprehenderit repellat veniam beatae. Sapiente necessitatibus quod et in dicta rem veritatis. Nam rerum architecto quas earum. Enim sed optio qui enim dolore possimus quisquam eum.,Colombia,Hauck, Keebler and Yundt,STORAGE,d554e720-870a-4088-9bcb-dce8aecaa047
de6f40aa-e81f-4043-925b-f990171e2f46,Intelligent Concrete Hat,3709,EUR,https://s3.amazonaws.com/uifaces/faces/twitter/samscouto/128.jpg,Dolorem adipisci nesciunt delectus ut. Sunt rerum animi nam vel. Eos earum voluptates dolores eos voluptas tenetur dolores aut. Quam molestias corporis magnam dolorem odit quo recusandae quidem qui.,4,Adipisci fugit rem saepe veniam quas ex sapiente. Itaque quae ipsa qui tempora quam id minima quis autem. Consequatur tenetur quaerat. Nulla laudantium eaque eum.,Grenada,Schinner - Franecki,STORAGE,d554e720-870a-4088-9bcb-dce8aecaa047
b25c0b7e-68c7-4bb9-b85c-a70c50d42396,Handcrafted Wooden Computer,9809,EUR,https://s3.amazonaws.com/uifaces/faces/twitter/mandalareopens/128.jpg,Eos voluptas ipsam rerum in omnis et. Est quos pariatur harum rem et corporis. Quo voluptates et. Sed dolorem cupiditate iusto veritatis qui.,2,Veniam vero qui. Officiis qui sunt. Dicta occaecati est rem ipsa consequatur aut dolores ipsum.,Algeria,Lindgren - Cormier,OK,79e89cf8-eeb5-46fd-9988-b3c8fbb2413c
2ceb22b8-cba1-452e-9166-ef113ad6455f,Tasty Wooden Salad,5454,USD,https://s3.amazonaws.com/uifaces/faces/twitter/tom_even/128.jpg,Culpa sint dicta dolor voluptatem. Quae reprehenderit est. Deleniti dignissimos dignissimos voluptatibus ratione. Laborum eligendi corrupti est iste animi vel in. Omnis tempore dicta officiis et quae doloribus doloremque accusamus nobis. Sit sed consequatur.,2,Sint accusantium vitae nesciunt dolor saepe. Voluptatum quod possimus id consequatur tempore quia nam. Nobis ut saepe delectus. Quis amet reiciendis est. Dolores nemo dolor dolorem consequuntur enim itaque doloremque pariatur.,Guatemala,Harber Inc,OUT_OF_STOCK,79e89cf8-eeb5-46fd-9988-b3c8fbb2413c
99ebc34c-a539-4d74-a79b-29e0b0702a1e,Handcrafted Cotton Mouse,6979,USD,https://s3.amazonaws.com/uifaces/faces/twitter/mattlat/128.jpg,Porro et velit ipsa. Eos a et aut similique ut. Qui ad rerum at cupiditate et.,5,Deserunt asperiores ducimus dolor nostrum blanditiis. Laborum quo esse qui harum voluptates sit sit et. Voluptates voluptas exercitationem accusantium eaque consectetur rerum temporibus libero necessitatibus. Architecto labore est natus. Et illo qui at quo et iste officia. Quas maxime nesciunt eum optio quae error fugiat.,El Salvador,Leffler, Konopelski and Hodkiewicz,OK,79e89cf8-eeb5-46fd-9988-b3c8fbb2413c
8dfb7a4b-305c-4f09-97c3-a7048c6dd60c,Unbranded Granite Salad,9770,USD,https://s3.amazonaws.com/uifaces/faces/twitter/billyroshan/128.jpg,Vel et sed consequuntur est nulla cumque. Nam in dolor est sapiente dolore tenetur. Voluptas voluptatibus occaecati harum reiciendis et qui minima. Ex dolor ipsam autem natus saepe commodi. Ipsam ipsum sed et et mollitia. Exercitationem eum voluptates delectus facere vitae quis aliquid.,4,Rerum accusamus molestiae placeat provident nisi voluptatem molestiae. Vero consectetur repellendus earum voluptate voluptatem. Impedit minus consequatur fugit. Consectetur sed mollitia beatae. Est autem quae qui quia et ullam vel adipisci dicta.,Costa Rica,Dach, Baumbach and O'Keefe,OK,79e89cf8-eeb5-46fd-9988-b3c8fbb2413c
530c31db-1bc0-4bc0-8807-c74c7bbc339d,Gorgeous Concrete Pizza,6851,USD,https://s3.amazonaws.com/uifaces/faces/twitter/elliotnolten/128.jpg,Error quis delectus sunt qui cum. Qui provident rerum laboriosam asperiores et sit repellendus autem sequi. Quaerat et rem corporis inventore. Eos omnis excepturi fugit iure eveniet in tenetur. Dolore neque molestiae cum magni consequatur omnis modi officia omnis.,3,Sint cumque eos. Ullam minus saepe beatae enim. Quo quibusdam perspiciatis temporibus autem et culpa nulla asperiores neque. Ut dolor sunt aut iusto ipsa et.,Denmark,O'Kon LLC,OK,4cf5fbab-e6d9-44c1-8f80-eacfc9218b28
8a4bf815-1d44-479c-936e-25582609199c,Small Wooden Computer,4635,USD,https://s3.amazonaws.com/uifaces/faces/twitter/gojeanyn/128.jpg,Ipsam voluptatum eius necessitatibus. Voluptatem minus veritatis ipsam quae. Repellendus quidem nihil voluptas aut ad a reprehenderit. Dolore incidunt deleniti velit a aspernatur nihil voluptatibus eum.,1,Sunt eos ratione. Expedita ab non sapiente quae est. Et iusto illo mollitia ut animi hic excepturi blanditiis. Sint ut quis atque ut. Rerum et aut aut ipsum ipsum cupiditate. Ut et dolorem aspernatur repudiandae et sint dolore aspernatur dolore.,Sierra Leone,Rutherford, Cummerata and Windler,OK,4cf5fbab-e6d9-44c1-8f80-eacfc9218b28
df0f80a4-b69b-43f6-9395-a36772964cf8,Refined Soft Towels,5095,USD,https://s3.amazonaws.com/uifaces/faces/twitter/javorszky/128.jpg,Et assumenda non est nemo totam consequatur similique omnis. Ea inventore veritatis voluptatibus debitis. Ipsa est corporis ut necessitatibus ea qui. Sit illo voluptas.,3,Quis necessitatibus itaque ducimus quis aut optio nihil. Odit aliquam et dolore doloremque sed assumenda odio blanditiis. Velit ducimus est quidem aut ipsam qui. Aliquam eos corporis non aspernatur consequatur.,Western Sahara,Romaguera LLC,OK,4cf5fbab-e6d9-44c1-8f80-eacfc9218b28
7159c889-1acd-44b9-ba6f-a6be5f634022,Ergonomic Fresh Tuna,4828,USD,https://s3.amazonaws.com/uifaces/faces/twitter/llun/128.jpg,Ipsum aut culpa cupiditate. Sint voluptatem sed non incidunt expedita. Ad labore ut officiis numquam qui nisi. Sed sunt temporibus eius magni et cumque. Et dicta recusandae et. Quaerat repellat aut hic veritatis molestiae.,3,Explicabo adipisci a vel ipsa aspernatur consequatur sed. Libero magnam nostrum. Ea quo saepe nesciunt velit eum quos voluptas exercitationem eum. Neque quia modi.,United States of America,Moore Group,OK,4cf5fbab-e6d9-44c1-8f80-eacfc9218b28
a2e6d5ab-3761-4cdc-aa7f-b8c389b2c09f,Gorgeous Fresh Computer,7194,USD,https://s3.amazonaws.com/uifaces/faces/twitter/danro/128.jpg,Placeat dolor voluptates beatae. Quia ducimus reprehenderit et. Et qui minima sit aut laboriosam vero. Assumenda autem rerum eaque consequuntur reiciendis accusamus vero eligendi. Illum atque expedita at.,4,Accusamus quas quo consequuntur maiores qui consequuntur. Nemo quia sequi qui quam nesciunt. Eveniet sed debitis at. Ut rerum voluptatem.,Vietnam,Rempel, Abernathy and Bailey,OUT_OF_STOCK,1fd20164-0406-47f4-b6a9-a9894ba7fe04
17188020-1f83-422a-8079-50ffcf42bbca,Small Metal Towels,2424,USD,https://s3.amazonaws.com/uifaces/faces/twitter/jjsiii/128.jpg,Quia minima corrupti quo qui dolorem. Quia aspernatur velit optio quibusdam dolorum mollitia aut inventore. Corrupti quia et. Quia nihil consequatur sed libero unde dolor maiores magnam asperiores. Illum hic neque incidunt vero enim ad. Numquam repellat porro omnis odio adipisci voluptatem.,5,Tenetur vero rem optio quis quibusdam rerum nihil. Quod ducimus inventore adipisci mollitia et blanditiis a quo culpa. Ullam recusandae et voluptatem natus. Sequi mollitia dicta possimus libero ullam rerum amet rerum.,Bolivia,Rolfson Group,OUT_OF_STOCK,4cf5fbab-e6d9-44c1-8f80-eacfc9218b28
3580a6ee-e10e-4453-b64b-1ad325ac9e62,Refined Plastic Chips,8515,USD,https://s3.amazonaws.com/uifaces/faces/twitter/samscouto/128.jpg,Expedita numquam iusto vel sed. Ab enim facere. Et qui ad.,3,Sed culpa perspiciatis. Ut molestias in aut esse adipisci consequatur dicta eum. Quo recusandae a amet enim vel sit iusto culpa. Autem deserunt nihil atque voluptates vitae dignissimos molestiae ipsa. Dolorem non labore asperiores eligendi assumenda. Fugit velit sed iste molestiae natus commodi vero rerum.,Montenegro,Roob and Sons,STORAGE,1fd20164-0406-47f4-b6a9-a9894ba7fe04
ae6ededa-9ddc-4820-af08-2d00936aa4e6,Awesome Plastic Fish,9561,USD,https://s3.amazonaws.com/uifaces/faces/twitter/supjoey/128.jpg,Eligendi voluptatem dolorem explicabo quos pariatur sapiente excepturi. Delectus accusamus magnam eveniet repudiandae atque cupiditate porro illo. Dolore error iste minus dolores esse sed. Ratione illo et modi aliquid.,5,Velit velit nihil veniam voluptate nam voluptas mollitia placeat et. Sed animi eum ut eius sunt quo ut voluptas officiis. Tempora iure omnis. Corporis consequuntur et quisquam. Eos aut saepe quos quisquam ipsa sint. Dignissimos voluptas dolorem praesentium et iste.,Kuwait,Johnston - Hane,STORAGE,4cf5fbab-e6d9-44c1-8f80-eacfc9218b28
cca8fdff-5069-4ed8-bc11-b9e15d351faa,Generic Metal Car,1254,USD,https://s3.amazonaws.com/uifaces/faces/twitter/ludwiczakpawel/128.jpg,Ut enim blanditiis iure. Commodi et laborum quos quia debitis distinctio. Dicta sit molestiae ex excepturi est culpa.,5,Dicta sit soluta officia. Ipsa voluptas enim soluta explicabo odit. Optio blanditiis libero et rem accusamus aliquid laboriosam. Aut necessitatibus voluptatem numquam aliquid itaque. Perferendis temporibus eius asperiores consequatur voluptatem deleniti aperiam aut quam. Sed ab et consequatur sed earum.,American Samoa,Schultz and Sons,OK,a3b58c52-196b-4f12-8bdc-23dbb9fb7745
37a42b00-0571-4ece-8487-69b64c01fe9c,Licensed Fresh Sausages,9255,USD,https://s3.amazonaws.com/uifaces/faces/twitter/osmanince/128.jpg,Dolorem incidunt aliquid ratione. Nobis ut similique. Hic esse rerum similique culpa provident. Quis modi et alias enim autem omnis earum.,4,In tempore autem sit sed reprehenderit repudiandae commodi. Recusandae voluptatem aliquam consequuntur id quibusdam repellat molestias provident. Vel culpa odit culpa voluptatibus ut. Maxime culpa qui saepe fugit dolore.,Zambia,Powlowski - Swift,STORAGE,1fd20164-0406-47f4-b6a9-a9894ba7fe04
2f7c7fa7-6334-42f8-a103-94b7cccae38e,Ergonomic Plastic Car,6616,USD,https://s3.amazonaws.com/uifaces/faces/twitter/matthewkay_/128.jpg,Quisquam sequi rerum ut molestias sed voluptatum. Voluptates odit dolorem. Sed et modi. Officiis et eaque iure a et dicta porro non quia. Sunt et iste debitis ipsam exercitationem est. Quod non veniam ut enim ipsum et cum.,3,Sint voluptatem omnis soluta. Deserunt tempore unde iste architecto nobis quo. Quia eos debitis.,Tuvalu,Feil - Wiegand,OK,a3b58c52-196b-4f12-8bdc-23dbb9fb7745
39b0e0d8-f021-4959-b952-47f956c0e8da,Fantastic Soft Hat,7906,USD,https://s3.amazonaws.com/uifaces/faces/twitter/yehudab/128.jpg,Eveniet aliquam provident assumenda est unde asperiores enim. Aut non magnam in. Laborum voluptatem nostrum dolores aliquid id ut. Qui ut molestias sed repellendus recusandae architecto.,4,Qui quia dignissimos quia quidem saepe quod. Ratione voluptas dolorem ut molestiae quod animi magni et. Fugiat aut voluptates est non possimus. Magnam autem magni. Et id et beatae aperiam dolore.,Egypt,Kunde, Nienow and Cormier,OK,a3b58c52-196b-4f12-8bdc-23dbb9fb7745
0dc7fd33-5404-4744-8581-aa5347b1c73c,Generic Granite Pants,4178,USD,https://s3.amazonaws.com/uifaces/faces/twitter/kazaky999/128.jpg,Vel quibusdam ab ipsam commodi laboriosam ut aut quibusdam. Magnam autem exercitationem quaerat. Expedita blanditiis ea neque asperiores. Fugiat molestiae quis velit accusantium. Ullam veniam enim ex ut dicta reprehenderit omnis qui dolore.,3,Voluptatum fugiat vel sunt repellat dolores voluptatem rem. Ipsum explicabo natus. Dolore excepturi consequatur eius est incidunt. Aut tempore odio quaerat quia consequatr molestiae quis. Asperiores quia ratione possimus voluptas a et expedita recusandae voluptas.,French Southern Territories,Walter, Walker and Gibson,OUT_OF_STOCK,a3b58c52-196b-4f12-8bdc-23dbb9fb7745
13e0f97a-f728-4eef-a34e-a596c5b8eeb7,Ergonomic Granite Bike,2637,USD,https://s3.amazonaws.com/uifaces/faces/twitter/lebronjennan/128.jpg,Molestias sint id. Repellat et ut unde atque. Numquam optio ad aut quia blanditiis. Quasi dolores nostrum quod incidunt quisquam qui dolores officia. Officia sunt maiores quod quae consequuntur illo perferendis doloribus debitis. Aliquid enim architecto corrupti rerum quia eveniet alias.,5,Est aut ab eos consequatur voluptas quia earum. Soluta voluptatem voluptatibus asperiores ratione voluptate unde. Quo et aut iste.,Palestinian Territory,Schaden Inc,STORAGE,a3b58c52-196b-4f12-8bdc-23dbb9fb7745
60a7f5af-5e30-469b-a460-7154d3580d04,Licensed Fresh Computer,9741,USD,https://s3.amazonaws.com/uifaces/faces/twitter/souperphly/128.jpg,Id cum quia cupiditate possimus ut optio tenetur voluptatem aperiam. Sed voluptatem sed atque quia. Omnis voluptatum rerum molestias. Est numquam cumque fuga suscipit in labore.,4,Quis laboriosam repudiandae sint voluptatum odio consectetur debitis. Dolores corporis enim dolores. Voluptas ut sed officiis earum quia. Provident tenetur voluptates ipsum rerum ipsam in ea vel debitis. Non libero dolor nobis culpa voluptatum quia aperiam sunt ullam.,United Kingdom,Conroy, Nader and Schuster,OK,a3b58c52-196b-4f12-8bdc-23dbb9fb7745
55506016-5c30-4703-86ff-8c80f7be31bc,Handmade Cotton Bacon,3008,USD,https://s3.amazonaws.com/uifaces/faces/twitter/popey/128.jpg,Libero voluptatum quae sit enim illum quis mollitia eligendi. Occaecati voluptas ab quod aut quidem eaque laborum dolorem. A expedita aut esse sint consequatur dolor sequi aut. Id ipsum quia. Sit aperiam quos voluptates quaerat aliquid consequatur voluptatem totam.,5,Aut quo quia qui cumque accusantium quia. Hic et quasi aut. Qui id ea tempore.,Pakistan,Pfannerstill Group,OK,bac9b7bc-d43e-4c89-9172-5cf890798e03
ca592c1b-ff90-429d-afbe-1cb87c516267,Generic Rubber Towels,8843,USD,https://s3.amazonaws.com/uifaces/faces/twitter/mizhgan/128.jpg,Repellendus voluptas sequi cupiditate harum illo quibusdam mollitia non et. Quia aliquid ea. Distinctio laborum dolorem exercitationem soluta ducimus deleniti rerum labore esse. Consequatur vitae nesciunt deserunt occaecati qui.,3,Voluptatibus ipsum molestias voluptatum omnis vel aut qui aut. Numquam consequuntur earum nulla placeat aperiam sint ducimus. Vel et porro enim sit voluptatum ut. Quod repellat itaque explicabo ex unde mollitia aut. Enim quisquam consequatur.,Marshall Islands,Schiller, Beahan and Fay,OK,bac9b7bc-d43e-4c89-9172-5cf890798e03
6825f4b5-c59c-48d6-8bd7-764b44d934cd,Gorgeous Soft Bacon,9249,USD,https://s3.amazonaws.com/uifaces/faces/twitter/deeenright/128.jpg,Ea odit cumque iusto eligendi totam. Adipisci et assumenda nemo sequi iste rerum eum. Fugiat laborum asperiores quisquam blanditiis culpa doloribus quas excepturi.,1,Et sit hic iste eligendi repudiandae quo eius cumque est. Beatae eius nostrum incidunt. Autem ut expedita magnam perferendis. Ipsum aut omnis consequatur. Et quae qui eum voluptatem sit odit.,Sierra Leone,Bauch LLC,OUT_OF_STOCK,bac9b7bc-d43e-4c89-9172-5cf890798e03
5d54f085-2239-44dd-89b6-ad92b5cce6eb,Rustic Granite Chips,8957,USD,https://s3.amazonaws.com/uifaces/faces/twitter/lingeswaran/128.jpg,Eaque eligendi qui tempora corrupti. Repellendus possimus corporis maxime consequatur. Quo ea a perferendis sit quis magnam.,5,Dolor dolorum qui ipsum corporis provident commodi quas dolores. Impedit quia porro dolor. Voluptates ut ea quia enim. Officiis illum beatae voluptas. Aut maiores expedita ullam voluptatum et.,Mayotte,Abshire, Watsica and Weissnat,STORAGE,bac9b7bc-d43e-4c89-9172-5cf890798e03
