ID,Name,Price_amount,Price_currency,Photo,Specs,Rating,SupplierInfo,MadeIn,ProductionCompanyName,Status,Store_ID
e00eb459-4914-415d-9ea4-5a0a047e0163,Awesome Concrete Table,7786,EUR,https://s3.amazonaws.com/uifaces/faces/twitter/tomaslau/128.jpg,Consequuntur laborum deleniti dolorem aliquid nisi ratione illo. Quo numquam fuga laboriosam. Cumque similique iure exercitationem iusto. Ex omnis necessitatibus. Est optio et quia non aut atque.,4,Quasi asperiores dolores id inventore. Odit exercitationem quidem quia et quis cumque molestiae est est. Velit cumque nisi eius quas doloribus corrupti commodi.,Malaysia,Cormier, Yundt and Oberbrunner,OK,1228d78d-05ff-41c6-b1c9-78be881be203
3e37324f-9be7-442e-b805-4b7fffb4b658,Licensed Cotton Cheese,3065,EUR,https://s3.amazonaws.com/uifaces/faces/twitter/artvavs/128.jpg,Nam quaerat aut. Sapiente qui doloribus vel voluptate rerum omnis dolorum quia praesentium. Temporibus culpa et. Blanditiis iusto sit. Eum dolorem et dolore voluptates accusantium praesentium magni. Incidunt voluptas ut voluptate dolore mollitia et.,5,Impedit maxime eos. Sed quis ratione nulla. Cupiditate occaecati molestiae commodi possimus sit magnam. Facere nulla atque doloremque ex est ea. Sit sed omnis vitae nihil occaecati quia tempore laboriosam quod.,Nauru,Pouros, Murphy and Eichmann,OK,1228d78d-05ff-41c6-b1c9-78be881be203
3146e952-aee7-4aeb-acf3-6e79a9424226,Unbranded Wooden Cheese,5664,EUR,https://s3.amazonaws.com/uifaces/faces/twitter/liminha/128.jpg,Doloribus rem reprehenderit in voluptates quibusdam. Cupiditate illum quis sapiente dolorum deserunt. Eos mollitia iure et rem quasi. Inventore sapiente et ut neque. Fugit at non. Laudantium rerum rerum omnis necessitatibus architecto error et.,1,Aliquid quia eos recusandae non molestias possimus quisquam eius. Quis porro est sint eveniet. Et voluptatem qui voluptate eius.,Mexico,Harris and Sons,STORAGE,1228d78d-05ff-41c6-b1c9-78be881be203
1f9798b7-ddbd-410f-9e3c-c9393d48375b,Tasty Soft Soap,1053,EUR,https://s3.amazonaws.com/uifaces/faces/twitter/byryan/128.jpg,Qui molestiae architecto harum blanditiis voluptatum minima vel iusto. Corporis labore sint voluptatem laboriosam inventore. Harum ut quia. Labore sint similique ullam. Hic vel saepe.,4,Aut doloribus architecto reiciendis fuga harum sit cum. Dignissimos consequatur molestias et natus soluta molestiae. Asperiores hic est culpa tempore dolorem voluptates. Eligendi quaerat minima aliquam et suscipit. Consequatur accusamus sequi tenetur eum dolor enim dolor. Aut sint sed sequi ex porro nihil exercitationem sint est.,Turks and Caicos Islands,Ernser and Sons,OK,1228d78d-05ff-41c6-b1c9-78be881be203
9b512003-1428-4e14-b352-26e0adc96780,Small Rubber Fish,1600,EUR,https://s3.amazonaws.com/uifaces/faces/twitter/jlsolerdeltoro/128.jpg,Est est qui adipisci odit pariatur. Quia necessitatibus dolor est ratione. Quas autem quod.,2,Voluptatem nihil sed rerum ratione sapiente animi vero. Dolorem fugiat voluptatem corporis a facilis. Et eveniet rerum facilis eum delectus pariatur asperiores voluptatem. Aliquam amet alias et dolores at reiciendis et. Voluptatum commodi odit est. Amet quis et enim sit aliquid.,Libyan Arab Jamahiriya,Turcotte - Boehm,OUT_OF_STOCK,1228d78d-05ff-41c6-b1c9-78be881be203
42b88151-5484-4fbb-a925-9f48e4979a41,Practical Plastic Table,3671,EUR,https://s3.amazonaws.com/uifaces/faces/twitter/dorphern/128.jpg,Consequatur est velit ullam iure a unde dolorum nostrum. Aut incidunt doloremque. Veniam et alias optio quas sunt eum ipsa. Velit veniam dolor.,4,Inventore repudiandae officiis itaque non aut. Praesentium eum maiores ab eaque corporis at. Voluptas et dolores amet. Tempora aut maiores hic ut occaecati aspernatur exercitationem incidunt modi. Ab sit perspiciatis harum.,San Marino,Barrows and Sons,STORAGE,1228d78d-05ff-41c6-b1c9-78be881be203
bf1507a9-faec-4451-bb44-cbdf95565a1e,Small Rubber Pizza,6838,EUR,https://s3.amazonaws.com/uifaces/faces/twitter/sementiy/128.jpg,Numquam fuga necessitatibus est. Eum eaque quae corrupti voluptas expedita labore. Beatae laborum fugit excepturi iure dolor dolores vitae ut. Architecto facilis ipsam.,1,Voluptatem rerum magni tenetur. Accusamus quos distinctio rem soluta. Expedita in est repellat nostrum corporis. Numquam voluptatem autem saepe et rerum.,Slovakia (Slovak Republic),Schowalter and Sons,OUT_OF_STOCK,1228d78d-05ff-41c6-b1c9-78be881be203
bc54874d-e73d-4a78-8984-ecd50957e93b,Small Metal Bacon,4331,EUR,https://s3.amazonaws.com/uifaces/faces/twitter/maximseshuk/128.jpg,Sit beatae ipsam quas. Deserunt dolorem aut distinctio exercitationem est. Beatae est hic autem nam facilis mollitia molestiae officia. Quaerat recusandae et aut omnis deserunt non enim eum. Voluptas excepturi nostrum et et quis porro sit temporibus saepe.,1,Perspiciatis et aperiam veritatis ducimus aut voluptatem. Enim ducimus sit et aperiam tempora consequatur. Optio hic et vero accusamus quo asperiores natus qui dolor.,Chad,Orn - Purdy,STORAGE,6eb2935e-cbd1-46be-b1fa-e04ae14a6272
d5478862-ae40-4cbd-ba5f-e2a8f12d1e81,Practical Granite Computer,1453,EUR,https://s3.amazonaws.com/uifaces/faces/twitter/peejfancher/128.jpg,Assumenda exercitationem minus autem sequi odio qui. Hic ullam et. Hic ex reiciendis veritatis praesentium molestiae debitis omnis numquam.,4,Dolore sit et magnam mollitia praesentium aliquam est. Sapiente aut consequatur alias. Quos harum ut perferendis. Eveniet quidem libero porro quia. Aut temporibus sapiente iure cumque.,Grenada,Gaylord, Brekke and Zemlak,STORAGE,6eb2935e-cbd1-46be-b1fa-e04ae14a6272
8ab50654-d7c2-469f-888e-254ecd2b191b,Rustic Cotton Chips,5395,USD,https://s3.amazonaws.com/uifaces/faces/twitter/uberschizo/128.jpg,Hic cum quis cumque tempora maxime veritatis repellendus labore. Non harum veniam voluptatum. Ea adipisci labore excepturi quo doloremque ab sapiente natus asperiores. Vitae veniam rem consectetur amet illum.,2,Quia totam at aliquid ut nostrum mollitia. Voluptatibus architecto ut vero nesciunt. Voluptas nemo in possimus quo totam dolorem. Non dolor adipisci. Deserunt sint blanditiis cumque distinctio sapiente eos iste eum ut.,Peru,Hamill LLC,STORAGE,6eb2935e-cbd1-46be-b1fa-e04ae14a6272
ab56fa25-ecf2-45fd-83db-05b1ce0681ed,Rustic Frozen Computer,4841,USD,https://s3.amazonaws.com/uifaces/faces/twitter/pyronite/128.jpg,Iste molestiae delectus. Modi architecto reprehenderit voluptatibus reprehenderit eaque. Aliquam distinctio tempora laudantium sunt cupiditate eos. Error est est pariatur.,5,Quo pariatur voluptatibus. Consequuntur iste modi pariatur molestiae omnis reiciendis sed. Officia voluptas qui ea id enim nesciunt consequuntur rerum. Optio atque facilis eaque odio.,Thailand,Reynolds, Ullrich and Kerluke,OK,6eb2935e-cbd1-46be-b1fa-e04ae14a6272
81386cc7-7949-4643-af2c-1080ac7d12c0,Refined Soft Bacon,5415,USD,https://s3.amazonaws.com/uifaces/faces/twitter/brandonmorreale/128.jpg,Et aspernatur et rerum amet ut ipsam et. Ratione voluptates blanditiis qui doloremque exercitationem. Necessitatibus reprehenderit non facere a voluptatum a. Consequatur quis aut possimus ipsam enim asperiores voluptatem voluptas.,2,Voluptatem dignissimos eos. Aut natus aperiam libero et nam. Officia unde quo consequuntur esse harum tenetur. Consequatur soluta quisquam voluptate reprehenderit quo ducimus velit voluptatibus. Qui officiis rem cum provident ipsa animi ut odio nemo.,Pakistan,O'Kon - Hyatt,OK,6eb2935e-cbd1-46be-b1fa-e04ae14a6272
b585a132-8194-4a65-b560-e3e2a6adb713,Sleek Frozen Bacon,9863,USD,https://s3.amazonaws.com/uifaces/faces/twitter/alecarpentier/128.jpg,Id natus mollitia quam aut repudiandae maiores rerum accusantium distinctio. Sint expedita adipisci est eius. Qui reiciendis animi corporis ipsum sit repellat ut totam. Magnam voluptate ad qui eaque aut.,2,Ut laborum eius eum dolore voluptatem et voluptatem aspernatur. Qui explicabo praesentium suscipit quia adipisci. Numquam debitis deserunt consequatur excepturi error. Eum velit facere voluptatum et dolore debitis. Pariatur sapiente autem quia dolorem.,China,Homenick - Bosco,STORAGE,4a5a7a36-9973-4f30-bb64-5e28849dc98e
092bd11e-19ea-463d-b46c-a63453bc326a,Small Granite Salad,7317,USD,https://s3.amazonaws.com/uifaces/faces/twitter/mighty55/128.jpg,Qui est qui et sint qui velit vitae. Impedit temporibus saepe. Ab velit quia vel est. Et aperiam dolore et tempore unde corporis. Libero atque rerum nesciunt adipisci quas debitis minima.,2,Eligendi dignissimos expedita. Velit et quaerat qui non a impedit consectetur tempore. Vero commodi aut. Amet est est necessitatibus quidem. Nam vel fugit quaerat iusto laboriosam commodi reprehenderit eaque fuga.,Guyana,Mitchell, Little and Abbott,OUT_OF_STOCK,4a5a7a36-9973-4f30-bb64-5e28849dc98e
73d1089f-ad95-4e2e-a17a-9659dfa67693,Intelligent Plastic Gloves,4042,USD,https://s3.amazonaws.com/uifaces/faces/twitter/amanruzaini/128.jpg,Ut a est voluptatem tempore. Magnam omnis nihil ipsa sed. Et iure adipisci. Sit facilis et rerum expedita voluptas nam molestias non. Dicta omnis aperiam inventore quo praesentium voluptate.,3,Id fugiat similique pariatur sed sint sed voluptatem. Quis non ut sint dolore veniam quia illo reprehenderit aut. Quia natus minus quis aspernatur adipisci nostrum exercitationem. Voluptas saepe eveniet corrupti et molestiae quia. Dolores praesentium error.,Papua New Guinea,Nader and Sons,OUT_OF_STOCK,4a5a7a36-9973-4f30-bb64-5e28849dc98e
ccf92e7c-0753-4b12-812d-844ff28bc856,Tasty Concrete Gloves,3956,USD,https://s3.amazonaws.com/uifaces/faces/twitter/pierre_nel/128.jpg,Praesentium iste minus voluptatibus a veniam. Provident illum possimus. Neque voluptas nihil sunt ipsam. Et quaerat voluptas aliquam consectetur dolores animi excepturi. Velit autem cupiditate distinctio eligendi. Quod ea unde eum eligendi qui explicabo.,1,Molestias suscipit ut neque iure placeat omnis hic ipsum. Quia nisi veritatis consequuntur. Fugit eius reprehenderit. Sint labore provident facere quo quisquam.,Nicaragua,Connelly, Kilback and Kiehn,OUT_OF_STOCK,4a5a7a36-9973-4f30-bb64-5e28849dc98e
b6fee3c6-d07c-40c0-9635-9fa003a6fcc4,Gorgeous Soft Chair,7113,USD,https://s3.amazonaws.com/uifaces/faces/twitter/thaodang17/128.jpg,Sapiente maiores voluptates iste. In vero dolores dicta voluptas. Architecto voluptas labore consectetur reiciendis. Ducimus soluta voluptates voluptate quae fugit aut. Atque quia accusamus quaerat iure repellat provident. Itaque rerum vel expedita debitis iusto velit est.,3,Voluptatibus praesentium expedita ut. Porro praesentium asperiores esse nam aut. Impedit dolore vel omnis voluptatem et ut laudantium. Quo molestiae consequatur aliquam quos odio omnis dolor. Vitae consequatur ratione molestiae in.,Norfolk Island,Watsica - Gottlieb,STORAGE,4a5a7a36-9973-4f30-bb64-5e28849dc98e
49950260-de0c-4b23-9d66-b875d8cd500c,Tasty Rubber Soap,7061,USD,https://s3.amazonaws.com/uifaces/faces/twitter/michaelcomiskey/128.jpg,Aut aliquam maiores voluptatem voluptatem labore architecto. Tempora amet sapiente ut officiis. Aliquid numquam eos quia in molestiae et. Et eveniet qui ut voluptates fugiat. Facere ipsam in excepturi omnis animi. Nulla sunt modi debitis est ea saepe.,3,Odio rerum sequi vel voluptates. Ipsa nesciunt sit porro rerum sunt atque earum ipsum. Esse ex aliquid facilis rerum eos aliquid reiciendis sint. Accusantium odio optio voluptatem delectus est omnis. Molestiae et eaque.,Tuvalu,Balistreri and Sons,OUT_OF_STOCK,fd6600bd-a5e4-4e91-a6b0-292b0a7129d8
ad7d67b6-621d-4247-908a-5b4a53fdd83a,Rustic Fresh Shirt,9671,USD,https://s3.amazonaws.com/uifaces/faces/twitter/emmandenn/128.jpg,Necessitatibus rerum est ipsam non porro est necessitatibus consequatur ut. Et assumenda quod aut omnis harum impedit id. Fugiat adipisci vero illum sed provident ipsa sapiente ea ut. Et animi officia fugiat natus qui veniam voluptatem vitae. Aut neque sit alias inventore ut impedit nam nihil hic.,3,Dignissimos odio sit molestiae et. Illum aut explicabo quae maiores aut quia velit dolorum. Ab ratione quibusdam ut est cupiditate laboriosam. Est enim fuga qui. Quod quia voluptates ipsum dolorum sapiente. Sed inventore laborum aliquid sed.,Colombia,Huels Inc,OK,fd6600bd-a5e4-4e91-a6b0-292b0a7129d8
1e0a8252-1199-40c1-a9df-5a88cf2590a0,Generic Plastic Gloves,4157,EUR,https://s3.amazonaws.com/uifaces/faces/twitter/aluisio_azevedo/128.jpg,Labore aut explicabo minus. Ducimus et voluptates fuga. Laudantium ut accusantium ipsum cupiditate aut deserunt. Quis velit aut minus. Vel ea labore eos quis numquam rerum.,3,Rerum qui ex exercitationem aut quo sapiente sit accusamus. Neque dolores assumenda qui itaque labore aut qui. Adipisci voluptatem omnis quasi perspiciatis rerum ad et iure delectus.,Iran,Ernser - Feest,OK,fd6600bd-a5e4-4e91-a6b0-292b0a7129d8
a85e943c-ce21-4aa9-8aa5-828ad1fc8555,Generic Concrete Gloves,8476,EUR,https://s3.amazonaws.com/uifaces/faces/twitter/prinzadi/128.jpg,Sapiente aspernatur autem non quae sunt similique. Pariatur tempore est consequuntur quis expedita quibusdam aliquam temporibus. Nihil quis commodi ipsum doloremque autem et impedit facilis.,4,Aliquam sunt aut quis placeat animi id exercitationem culpa repudiandae. Eos rerum quidem cum esse. Nihil velit voluptas ab dolores et. Alias aut nisi possimus soluta ut. Repellendus suscipit beatae atque eos. Sit voluptas molestias esse alias velit dicta sequi est.,Ecuador,Fahey - Paucek,STORAGE,f8d44863-a9a6-41c1-a3f4-17f07525563b
0a446583-8b0c-4474-b03c-c995120ce227,Licensed Wooden Bike,1596,EUR,https://s3.amazonaws.com/uifaces/faces/twitter/maximseshuk/128.jpg,Accusantium sint doloribus veniam eaque. Porro quis temporibus sint in. Et quae qui facere est in omnis aut quibusdam. Aliquam officia sunt esse et autem. Quibusdam nesciunt ab dolorem non voluptas odit debitis. Recusandae voluptatibus aut facere maiores aut aut eligendi.,5,Itaque et rerum facilis. Minus accusantium aut rem. Nemo quam nesciunt. Provident mollitia eum ut omnis. Rerum quibusdam blanditiis magni deleniti voluptatem dolorem ratione omnis laboriosam.,Northern Mariana Islands,Sipes, Collins and Wisoky,STORAGE,f8d44863-a9a6-41c1-a3f4-17f07525563b
e397bf35-84cc-4e3e-836c-07c7be4a61f2,Incredible Metal Salad,1802,EUR,https://s3.amazonaws.com/uifaces/faces/twitter/louis_currie/128.jpg,Velit iure adipisci. Veniam quam culpa. Quo porro esse nobis dignissimos architecto dolores omnis sint.,4,Temporibus distinctio et error mollitia voluptatum temporibus aut sequi. Eos enim sint eos. Tenetur sequi dolores nostrum molestiae. Commodi non est sequi animi praesentium nemo. Minima repudiandae et harum. Consectetur ut corporis labore repudiandae.,Bangladesh,Haley, Schuster and Hand,OK,f8d44863-a9a6-41c1-a3f4-17f07525563b
fe4c5abb-8c03-419b-a976-668f752c6c74,Handcrafted Cotton Soap,9646,EUR,https://s3.amazonaws.com/uifaces/faces/twitter/victorerixon/128.jpg,Placeat totam tempora recusandae aliquam. Similique rem optio dignissimos. Quia fuga aliquid voluptatem sit non repudiandae labore dicta. Aut architecto et dicta ut et. Harum voluptatum iste.,4,In vero et exercitationem qui est quia repudiandae in officia. Animi ut natus perspiciatis. Iusto id ipsum repellendus voluptatem repellat dolor voluptatum et est. Hic possimus omnis omnis doloribus dolor et et illum. Minus et qui vero est molestiae ipsam hic. Animi assumenda libero sit repudiandae fugit voluptatum.,Zambia,Jones - Funk,OUT_OF_STOCK,f8d44863-a9a6-41c1-a3f4-17f07525563b
8693c95b-d4dd-4cb7-8edf-1f2ab1468676,Sleek Metal Ball,9482,EUR,https://s3.amazonaws.com/uifaces/faces/twitter/anaami/128.jpg,Velit ea id corporis explicabo molestias sapiente nihil dolor accusamus. Qui sapiente unde nulla ut quidem iste eligendi reiciendis minima. Est velit voluptatem inventore eligendi earum excepturi. Tempora hic vel. Illum officiis a molestiae corporis culpa ut vel atque.,4,Et et harum. Eos et fugiat iusto velit eum facilis. Quia est rem consectetur at. Porro corrupti voluptas aspernatur consequuntur iure vel eum. Ullam sed suscipit adipisci voluptatem.,Lao People's Democratic Republic,Ward, Heathcote and Rice,OUT_OF_STOCK,f8d44863-a9a6-41c1-a3f4-17f07525563b
9b13f7bf-46e4-4b78-8ecb-927ae2630bbd,Licensed Steel Pants,4845,EUR,https://s3.amazonaws.com/uifaces/faces/twitter/geneseleznev/128.jpg,Optio illum rerum laborum. Nulla voluptatem reprehenderit quod beatae inventore qui ipsum minima aut. Est consequatur sequi. Dicta illo possimus blanditiis velit officia laudantium at sequi qui. Rem illum nemo illo cupiditate ut ullam sunt odio saepe.,1,Nam et illo quia illo numquam provident. Sint similique debitis. Officiis perferendis dolorem quae explicabo sint est. Voluptate non architecto fugiat. Et ut voluptatibus rerum veritatis dolore quo non. Ea doloribus optio qui incidunt voluptatem odio omnis optio.,Virgin Islands, U.S.,Willms - Reilly,OK,0f2a2f80-5b19-450f-9b1a-99cb6fc25ee9
5627b243-3147-487f-a546-0552a1d61546,Incredible Rubber Bike,9537,EUR,https://s3.amazonaws.com/uifaces/faces/twitter/kianoshp/128.jpg,Enim et sit in laborum. Ut non quia delectus nam impedit. Cumque vel rerum qui ut aut veniam et animi amet. Fugiat ullam inventore autem eaque et.,5,Quia animi omnis nobis. Dolorum enim tempore sint. Maxime voluptatum cupiditate voluptatem dolorem cumque consectetur excepturi dolores corrupti. Hic non et provident. Dolorum ut ipsum. Quisquam odit tempora laborum consectetur magni minus nemo.,United Arab Emirates,Hayes Inc,OUT_OF_STOCK,0f2a2f80-5b19-450f-9b1a-99cb6fc25ee9
39f974b5-2d99-44a0-956e-b38a56057092,Ergonomic Soft Salad,3275,EUR,https://s3.amazonaws.com/uifaces/faces/twitter/heykenneth/128.jpg,Error consectetur delectus est facilis aut ex aut in. Totam molestiae vel illum. Dignissimos enim iusto dolor non sapiente molestiae illo magni. Fugit sequi impedit ut autem id asperiores minus.,5,Ipsum error ut aut corrupti quae minima deserunt recusandae. Id autem impedit quo et in eveniet sint voluptas et. Neque est voluptatem iste non consequuntur sunt atque. Nihil expedita excepturi cupiditate.,Wallis and Futuna,Kuphal - Stroman,STORAGE,0f2a2f80-5b19-450f-9b1a-99cb6fc25ee9
0675b0b8-e776-4d75-a7f1-fe31af7e2b3a,Sleek Frozen Computer,5878,USD,https://s3.amazonaws.com/uifaces/faces/twitter/devankoshal/128.jpg,Ea natus hic aliquam qui saepe excepturi commodi ex. Qui voluptas unde. Porro qui non.,5,In voluptatibus illum rerum. Dolore omnis autem atque sit temporibus veniam velit inventore. Asperiores deleniti consequatur vel fugiat repellendus rerum quia dolores. Molestias animi molestiae. Non consequuntur voluptatem dicta.,French Southern Territories,Kuhn and Sons,OUT_OF_STOCK,0f2a2f80-5b19-450f-9b1a-99cb6fc25ee9
608ca70f-51f2-4c63-aaa6-68ba69b0fb32,Ergonomic Granite Towels,2132,USD,https://s3.amazonaws.com/uifaces/faces/twitter/besbujupi/128.jpg,Illum nobis optio voluptate alias at pariatur. Officia ex unde incidunt occaecati. Dolor aliquam in natus eligendi aspernatur maiores ut quibusdam et. Reprehenderit qui nulla accusantium ipsum et ea.,3,Amet omnis tempore itaque impedit et. Et quas vitae dicta dolores laborum vero itaque sit ea. Possimus voluptas eligendi omnis placeat non. Quos excepturi et sunt ut hic sit voluptate recusandae tempore. Alias suscipit non quis velit eligendi dolor tempore. Aut voluptas ullam omnis vero accusantium asperiores.,Ireland,Carroll - Beatty,OUT_OF_STOCK,0f2a2f80-5b19-450f-9b1a-99cb6fc25ee9
75e5d766-6a3e-4259-86b8-54ca9542392e,Rustic Soft Computer,8240,USD,https://s3.amazonaws.com/uifaces/faces/twitter/malykhinv/128.jpg,Unde quaerat non qui est doloremque eum. Aperiam cumque maiores repudiandae temporibus commodi error perferendis. Debitis dolore dolores culpa ut id cum aperiam. Sit ab qui earum. Enim deserunt repellendus hic qui.,3,Et dignissimos impedit rerum qui. Et commodi pariatur repellat nihil eligendi maiores et qui. Dolor pariatur eum inventore voluptatem at nihil velit. Et quisquam a sit deserunt asperiores voluptatibus repellendus et exercitationem. Commodi et quam nihil.,Tanzania,Wiegand, Zieme and Pfannerstill,STORAGE,0f2a2f80-5b19-450f-9b1a-99cb6fc25ee9
33c45197-5ff1-4646-bb67-44a6f6320771,Unbranded Granite Table,3562,USD,https://s3.amazonaws.com/uifaces/faces/twitter/nelsonjoyce/128.jpg,Voluptas rerum harum quisquam optio. Quia error exercitationem magnam nesciunt expedita. Facere nam et aliquam deleniti molestias suscipit cupiditate. Neque amet aperiam ea velit eum suscipit odio neque. Rerum aut ad neque molestiae quia voluptatem aut et officia. A velit quia porro cum explicabo reprehenderit.,4,Provident inventore quisquam sunt error debitis et non. Ut quaerat unde dolores. Laboriosam incidunt et magnam totam deleniti nemo eos facilis occaecati. Et hic exercitationem error. Repudiandae autem modi veritatis quaerat.,San Marino,Rohan - Reilly,OK,0f2a2f80-5b19-450f-9b1a-99cb6fc25ee9
bc83070e-eded-4b01-8f14-0f6b0e0fdc0e,Incredible Metal Sausages,1599,USD,https://s3.amazonaws.com/uifaces/faces/twitter/danpliego/128.jpg,Voluptatem quaerat eveniet. Consequatur tempora aperiam praesentium veritatis dolorem nostrum. Qui ea ut nihil.,3,Ducimus et est tempore quo eius. Inventore sint ducimus sit est voluptatum placeat pariatur ut ut. Consequuntur omnis ipsum earum soluta fugiat ad in necessitatibus quia. Odit libero autem provident voluptas dolorum sit non maiores.,Virgin Islands, U.S.,Heller, Runolfsdottir and Wintheiser,OUT_OF_STOCK,0f2a2f80-5b19-450f-9b1a-99cb6fc25ee9
be2c13ab-9655-484d-ae08-de45836bc1c5,Fantastic Rubber Mouse,6405,USD,https://s3.amazonaws.com/uifaces/faces/twitter/victorquinn/128.jpg,Minus corporis est facilis quos. Modi explicabo eveniet sint nulla aut dolorem. Neque nesciunt qui quas.,3,Et ut est quam laborum perferendis ut amet. Voluptatem incidunt quibusdam minima nam qui ex velit ducimus. Occaecati rerum aut enim. Perspiciatis doloribus quae possimus esse quasi quae.,Romania,Greenfelder Group,OUT_OF_STOCK,480c81bb-b525-40a3-aa03-c49148386515
a8f2b515-7a84-45cc-8188-284af3142361,Intelligent Metal Sausages,4638,USD,https://s3.amazonaws.com/uifaces/faces/twitter/gabrielizalo/128.jpg,Dolorum consequuntur voluptatem et voluptatibus ut rerum a iusto sit. Repellat ea eligendi dignissimos quibusdam et. Ipsa nulla ipsa autem ullam deserunt repellat tempora nulla. Rem cumque nihil magni earum qui. Et magni molestias repudiandae est labore ut rerum et explicabo. Quia temporibus inventore et aperiam dolores similique et et animi.,3,Voluptates aut quibusdam fugit praesentium ea. Qui dignissimos saepe quos illum recusandae rem. Sit consequatur suscipit recusandae. Explicabo eum ducimus incidunt quae. Ut rerum ducimus. Tempore in delectus.,Timor-Leste,Zieme - Gottlieb,STORAGE,480c81bb-b525-40a3-aa03-c49148386515
5c7191c7-f039-4895-942a-6025d1481284,Licensed Steel Tuna,7842,USD,https://s3.amazonaws.com/uifaces/faces/twitter/wikiziner/128.jpg,Facilis porro delectus quaerat atque est alias qui. Necessitatibus fugiat consectetur aliquid aut. Sit iste qui sit.,1,Reiciendis id quas quis adipisci magni. Est quis rerum vitae vel voluptate placeat delectus fugit est. Voluptate quisquam odio dolores quas aspernatur. Autem placeat debitis.,Palestinian Territory,Reichel, Balistreri and Dooley,OUT_OF_STOCK,480c81bb-b525-40a3-aa03-c49148386515
af677002-00b8-4e2d-a377-6591bf020421,Awesome Frozen Table,1631,USD,https://s3.amazonaws.com/uifaces/faces/twitter/vinciarts/128.jpg,Blanditiis qui tempora ratione sit nihil. Illo at porro eum quibusdam eum non odio qui. Ullam temporibus excepturi.,4,Enim consequatur nihil sapiente velit ea. Et rerum dicta quia. Eveniet et quia.,Madagascar,Ziemann, Mraz and Bayer,STORAGE,480c81bb-b525-40a3-aa03-c49148386515
f3dcad7e-74c7-4b76-a8d1-97c0db06da75,Handmade Granite Pizza,9003,USD,https://s3.amazonaws.com/uifaces/faces/twitter/diansigitp/128.jpg,Atque molestiae natus ut quasi sed corporis. Vel quod quis explicabo eum est. Qui voluptas nisi tempore voluptas ut molestiae consequatur est quisquam. Quod eos accusantium doloremque delectus ut.,4,Eum voluptatem blanditiis voluptatem molestias non rerum nesciunt sunt. Rerum eveniet molestiae vel eligendi aliquid hic. Praesentium nemo aliquam nisi qui numquam error sunt. Omnis quos temporibus exercitationem reprehenderit. Consequuntur commodi dolor rerum voluptate earum incidunt. Accusamus explicabo error non iure mollitia est.,Czech Republic,Grimes - Towne,OUT_OF_STOCK,480c81bb-b525-40a3-aa03-c49148386515
0a36a1d8-878d-4b34-a8e1-c8f12088b7fa,Fantastic Frozen Computer,4177,USD,https://s3.amazonaws.com/uifaces/faces/twitter/sergeysafonov/128.jpg,Velit molestias aperiam quis est optio mollitia eaque. Et architecto nesciunt. Consequatur quam ut tenetur et magnam. Culpa distinctio et ad enim reiciendis omnis rerum natus et. Vel accusamus reprehenderit vel sed beatae quas molestiae.,1,Aut aut vero saepe repellendus aut. Quo suscipit ut error veritatis occaecati odio et. Rerum laudantium est quis aliquam quis et est.,Bosnia and Herzegovina,Reynolds, Marks and Rempel,STORAGE,480c81bb-b525-40a3-aa03-c49148386515
cb6d1ce0-77a0-46a5-a438-11ead5e956cb,Generic Fresh Sausages,8184,USD,https://s3.amazonaws.com/uifaces/faces/twitter/sbtransparent/128.jpg,Ipsa consequatur repudiandae quam totam pariatur. Vel et optio dolores voluptates enim aut esse perspiciatis in. Ut error vero.,4,Incidunt porro voluptas. Beatae et exercitationem nostrum adipisci consequatur vel rem. Molestiae quibusdam soluta accusamus iste.,Indonesia,Grimes - Crona,OK,480c81bb-b525-40a3-aa03-c49148386515
015b7ee5-b465-4680-9109-a00faf249d93,Incredible Concrete Computer,8731,USD,https://s3.amazonaws.com/uifaces/faces/twitter/her_ruu/128.jpg,Sunt quos voluptates quis. Doloremque incidunt fuga adipisci cumque voluptates dolorem ut dolorem perferendis. Veniam est non nisi est necessitatibus laudantium expedita. Dolores ea quo. Similique minima non ut illo velit nostrum omnis.,4,Quas dolorem laudantium ipsum consectetur aut. Tempora earum dolorem ea aspernatur. Animi ipsa dolorem et.,Nicaragua,Morar LLC,STORAGE,480c81bb-b525-40a3-aa03-c49148386515
