ID,Name,Price_amount,Price_currency,Photo,Specs,Rating,SupplierInfo,MadeIn,ProductionCompanyName,Status,Store_ID
d35da8c0-df61-4634-a353-09cc2f091ff6,Sleek Granite Fish,6513,EUR,,Ex velit quisquam fuga. Molestias omnis incidunt debitis aut. Dolores illo itaque recusandae odit. Error sit quo atque. Minima placeat harum nihil voluptatibus atque qui placeat voluptas quia. Minima voluptas omnis.,5,Doloremque quo aspernatur repudiandae recusandae et quas sunt qui soluta. Reiciendis molestiae minus architecto impedit quis in quidem quo distinctio. Voluptatem temporibus voluptate voluptas et iusto error. Asperiores deserunt non modi dolore. Et itaque quos laboriosam sit suscipit eveniet,Ukraine,Runolfsson - Smitham,OUT_OF_STOCK,0b99cf7c-7075-42a1-b01b-a2972209e64d
5fce646e-00ca-4187-8002-f050fed240d8,Handmade Rubber Car,7262,USD,https://s3.amazonaws.com/uifaces/faces/twitter/heykenneth/128.jpg,Libero adipisci sint veniam mollitia rerum et odio. Quia sed quibusdam voluptas id. Eum mollitia aut nihil quidem. Sit illo et minima vel debitis recusandae.,3,Dolor et aut. Autem neque debitis voluptas a eveniet nihil corporis. Esse harum aliquid quaerat debitis cumque dolor nihil.,Israel,Graham, Rodriguez and Bechtelar,OUT_OF_STOCK,18da6328-d816-4e95-a736-70b67953c59c
704b4359-c9da-4bed-ad60-d656b866525d,Fantastic Metal Car,2777,EUR,https://s3.amazonaws.com/uifaces/faces/twitter/timothycd/128.jpg,Commodi minus consequatur. Exercitationem a accusamus odit corporis aliquam mollitia sed. Praesentium debitis saepe amet. Nihil id dolores. Voluptas dolores autem quia provident numquam.,4,Facilis exercitationem officiis rem quia magnam aliquam. Ratione deleniti est minus iusto nihil at voluptatem hic. Eos eum harum id sit soluta. Placeat ut dolores natus perspiciatis id asperiores.,Monaco,Lesch - Balistreri,STORAGE,0b99cf7c-7075-42a1-b01b-a2972209e64d
9869343d-e24e-4542-97cd-26d30dbdcc63,Handcrafted Cotton Tuna,7455,USD,https://s3.amazonaws.com/uifaces/faces/twitter/mashaaaaal/128.jpg,Ex necessitatibus aliquam molestias autem reiciendis et ullam. Tenetur magnam maxime ipsum explicabo iure consequatur at et. A eos tenetur in vel voluptatem excepturi expedita voluptatem.,3,Ea ratione et voluptas in officia consequatur deleniti ut veniam. Quae quaerat quae tempore esse cumque qui. Quas suscipit ut earum libero quia quas libero ea. Eum consequatur provident et.,Congo,Morar Group,STORAGE,1fd20164-0406-47f4-b6a9-a9894ba7fe04
0482a0ca-65be-4b81-85d5-b90667439807,Sleek Granite Fish,6513,USD,,Ex velit quisquam fuga. Molestias omnis incidunt debitis aut. Dolores illo itaque recusandae odit. Error sit quo atque. Minima placeat harum nihil voluptatibus atque qui placeat voluptas quia. Minima voluptas omnis.,5,Doloremque quo aspernatur repudiandae recusandae et quas sunt qui soluta. Reiciendis molestiae minus architecto impedit quis in quidem quo distinctio. Voluptatem temporibus voluptate voluptas et iusto error. Asperiores deserunt non modi dolore. Et itaque quos laboriosam sit suscipit eveniet.,Ukraine,Runolfsson - Smitham,OUT_OF_STOCK,0b99cf7c-7075-42a1-b01b-a2972209e64d
a205720c-e293-4a5b-914b-1f0372022d11,Handmade Rubber Car,7262,USD,https://s3.amazonaws.com/uifaces/faces/twitter/heykenneth/128.jpg,Libero adipisci sint veniam mollitia rerum et odio. Quia sed quibusdam voluptas id. Eum mollitia aut nihil quidem. Sit illo et minima vel debitis recusandae.,3,Dolor et aut. Autem neque debitis voluptas a eveniet nihil corporis. Esse harum aliquid quaerat debitis cumque dolor nihil.,Israel,Graham, Rodriguez and Bechtelar,OUT_OF_STOCK,18da6328-d816-4e95-a736-70b67953c59c
f7e0a660-24c6-44f8-a815-1410674cee21,Fantastic Metal Car,2777,EUR,https://s3.amazonaws.com/uifaces/faces/twitter/timothycd/128.jpg,Commodi minus consequatur. Exercitationem a accusamus odit corporis aliquam mollitia sed. Praesentium debitis saepe amet. Nihil id dolores. Voluptas dolores autem quia provident numquam.,4,Facilis exercitationem officiis rem quia magnam aliquam. Ratione deleniti est minus iusto nihil at voluptatem hic. Eos eum harum id sit soluta. Placeat ut dolores natus perspiciatis id asperiores.,Monaco,Lesch - Balistreri,STORAGE,6eb2935e-cbd1-46be-b1fa-e04ae14a6272
07450de0-3682-4bf2-a1e7-a22053404d7b,Handcrafted Cotton Tuna,7455,EUR,https://s3.amazonaws.com/uifaces/faces/twitter/mashaaaaal/128.jpg,Ex necessitatibus aliquam molestias autem reiciendis et ullam. Tenetur magnam maxime ipsum explicabo iure consequatur at et. A eos tenetur in vel voluptatem excepturi expedita voluptatem.,3,Ea ratione et voluptas in officia consequatur deleniti ut veniam. Quae quaerat quae tempore esse cumque qui. Quas suscipit ut earum libero quia quas libero ea. Eum consequatur provident et.,Congo,Morar Group,STORAGE,0b99cf7c-7075-42a1-b01b-a2972209e64d
0d179d4a-c956-4826-9635-83419c2cd9f1,Sleek Fresh Towels,9271,EUR,https://s3.amazonaws.com/uifaces/faces/twitter/okandungel/128.jpg,Optio corrupti architecto culpa fugit quasi consequatur. Id sint qui veniam. In inventore facere. Vel aut porro placeat est perspiciatis vero rem. Et eveniet cupiditate explicabo et aspernatur omnis corporis doloremque tenetur.,1,Excepturi autem et quam unde ab laboriosam. Et vel voluptate sint quidem tempore sequi. Quo numquam eum. Vero soluta architecto accusamus tempore corrupti possimus itaque omnis. Corrupti non ipsum. Incidunt eligendi qui soluta aspernatur soluta.,Jersey,Huel Inc,OK,0b99cf7c-7075-42a1-b01b-a2972209e64d
08523757-b4ac-4aa4-a6b5-e48dff81a808,Fantastic Granite Hat,9781,USD,https://s3.amazonaws.com/uifaces/faces/twitter/nachtmeister/128.jpg,Saepe distinctio omnis voluptatem nam iste aliquam consequatur. Molestiae unde magni mollitia est unde. Soluta consequatur illum quia necessitatibus accusamus ipsam. A expedita repudiandae minima quis qui temporibus impedit.,4,Unde consequuntur quod repellendus officiis optio perferendis saepe aut. Dolorum in quis. Ut est laboriosam laudantium molestiae et doloribus.,Nigeria,Bergnaum, O'Kon and Wyman,OK,18da6328-d816-4e95-a736-70b67953c59c
22f291cc-3133-4125-b640-72bdee6e5d2f,Unbranded Metal Salad,3533,USD,https://s3.amazonaws.com/uifaces/faces/twitter/hsinyo23/128.jpg,Error quidem eaque. Dolorem facilis natus blanditiis quia tempora aut porro nulla dolor. Quo enim earum doloremque iste cum velit. Repudiandae accusantium numquam.,5,Doloribus repellat rem maxime reprehenderit et doloribus aut. Impedit dignissimos dolor ipsa saepe repellat libero. Expedita consequatur ex molestias nesciunt sit voluptate sit. Aut et assumenda sed dolores et et hic est. Ea corrupti laudantium. Cum voluptatibus quam nostrum.,Portugal,Davis and Sons,OUT_OF_STOCK,0b99cf7c-7075-42a1-b01b-a2972209e64d
22f291ce-3133-4125-b640-72bdee6e5d2f,Gorgeous Soft Ball,6948,EUR,https://s3.amazonaws.com/uifaces/faces/twitter/barputro/128.jpg,Incidunt blanditiis doloremque. Sint voluptate ipsa. Dolorem distinctio quod voluptas sapiente pariatur necessitatibus aperiam. Molestiae nihil veritatis. Ipsa quaerat eum. Nostrum nihil asperiores quis dolorum quisquam.,2,Neque aut quo quo praesentium. Vero fugiat eius debitis iusto soluta. Et iusto ut doloremque.,Croatia,Cronin, McLaughlin and Luettgen,STORAGE,18da6328-d816-4e95-a736-70b67953c59c
34c6caaa-f220-439f-8ee2-641f6360bcb3,Fantastic Rubber Shirt,9762,USD,https://s3.amazonaws.com/uifaces/faces/twitter/benoitboucart/128.jpg,Ipsa aliquid eum velit enim repellendus cum. Facilis cum animi quis aut facilis. Commodi aut est aliquam sunt dolores omnis aut culpa. Quas tenetur et. Aperiam suscipit inventore libero cumque. Occaecati perferendis sed ratione quia dolorem.,1,Ipsum et numquam rem saepe at dolores suscipit laudantium. Aut et ipsa laboriosam delectus ut sit veniam. Adipisci velit saepe nulla ex. Sint earum et et omnis vero nihil. Dolore molestiae dolores vel fuga sed perferendis earum optio.,Bulgaria,King Group,STORAGE,18da6328-d816-4e95-a736-70b67953c59c
51653860-e02a-42a1-bd9e-0f3414193906,Incredible Cotton Keyboard,5022,USD,https://s3.amazonaws.com/uifaces/faces/twitter/jasonmarkjones/128.jpg,Porro laboriosam eaque tenetur et dolor veritatis quos ut. Similique natus error repudiandae magnam. Eaque perspiciatis nemo quibusdam voluptatem illo laborum iusto.,5,Omnis velit voluptate enim tenetur culpa voluptas. Dolor nulla laborum rerum et et et illum. Praesentium a in voluptate enim voluptatem. Occaecati earum quod excepturi incidunt est occaecati voluptatem eos sint. Aliquam quos voluptate ad maiores iste quaerat ipsum. Fuga eius et suscipit est quo praesentium.,Hong Kong,Bahringer - Hilpert,OK,0b99cf7c-7075-42a1-b01b-a2972209e64d
8405f398-fc0d-4466-89c4-909608221e93,Tasty Soft Cheese,4131,EUR,https://s3.amazonaws.com/uifaces/faces/twitter/derienzo777/128.jpg,Aut enim ut itaque temporibus repellendus velit repellat architecto. Inventore autem laboriosam repudiandae dolor recusandae. Esse suscipit corporis impedit quos deleniti.,1,Beatae atque dolorem at. Facere aspernatur et fuga eligendi est architecto dolorem. Quibusdam et quam minima similique et dolores voluptas.,Swaziland,Lakin, Green and Lindgren,OK,1fd20164-0406-47f4-b6a9-a9894ba7fe04
fc6c50ee-be00-4897-9087-655206fed4bc,Practical Cotton Table,5325,USD,https://s3.amazonaws.com/uifaces/faces/twitter/tereshenkov/128.jpg,Ut quasi cumque minus maxime asperiores sit. Voluptates qui aut reiciendis voluptatem sit cumque minima vero. Est deserunt qui dolor iure voluptas nulla voluptas saepe. Ipsa optio est totam consectetur quis pariatur ullam. Dolorem ut doloribus vitae.,2,Voluptatem numquam molestiae qui vero nostrum. Provident corrupti aspernatur vero rerum. In et ullam tempore ratione. Nisi maxime reiciendis in.,Uruguay,Gutkowski, Howell and Hammes,STORAGE,18da6328-d816-4e95-a736-70b67953c59c
54fdb332-d90c-4505-9587-5e2dc8304c90,Generic Granite Bacon,8942,USD,https://s3.amazonaws.com/uifaces/faces/twitter/shadeed9/128.jpg,Laboriosam vitae atque nostrum aut quidem architecto laboriosam corporis. Rerum quam et enim asperiores possimus praesentium exercitationem ea sit. Quia laborum vel veniam. Occaecati dolores omnis minima similique soluta veritatis iure illum.,3,Dolores voluptatem animi iste. Deleniti et corrupti aut sit eum. Natus quis eaque. Adipisci voluptatem eum.,Gabon,Hane, Aufderhar and Russel,STORAGE,1fd20164-0406-47f4-b6a9-a9894ba7fe04
e3be7e9d-7400-4ad6-85ba-5649d0c8ba21,Sleek Plastic Gloves,5276,USD,,Molestias minus aut tempore ea. Et ut ut et et. Eveniet vitae ducimus maxime. Occaecati quas qui vel tempora quibusdam iusto. Sapiente quo voluptatem eligendi vero laborum repudiandae quia. Id sit omnis et.,4,Repellat facere nulla dignissimos quam in. Dolores voluptatem recusandae. Aut est quia qui. Earum nihil et ducimus earum ut. Possimus laboriosam dicta perspiciatis quis eos eius neque explicabo.,Oman,O'Connell - Bauch,OUT_OF_STOCK,1fd20164-0406-47f4-b6a9-a9894ba7fe04
77a31e52-39c5-4df7-9487-1ad089ce56b9,Unbranded Soft Pizza,6051,EUR,https://s3.amazonaws.com/uifaces/faces/twitter/alterchuca/128.jpg,Rerum corporis vel et rerum quo veritatis. Eius et enim. Nobis accusamus odit voluptas in. Voluptate qui ratione earum dolorem ut voluptatem. Cum minus ab doloremque dolor non totam aliquid voluptatem.,5,Molestiae necessitatibus dicta ratione dicta dolor. At eos placeat deleniti non quia est dignissimos in aut. Distinctio officia quis quis doloremque et soluta amet fuga. Ipsam deserunt molestiae reprehenderit vel nulla perspiciatis ut. Perspiciatis libero assumenda deserunt. Tempore aut expedita pariatur voluptatem optio sed quod.,Uzbekistan,Lockman - Kemmer,OUT_OF_STOCK,0b99cf7c-7075-42a1-b01b-a2972209e64d
75061c39-67eb-4a04-8e05-5b96fdd5191a,Ergonomic Metal Chair,6164,EUR,https://s3.amazonaws.com/uifaces/faces/twitter/collegeman/128.jpg,Voluptatem ea architecto eaque beatae quo dignissimos id quisquam quia. Expedita repellendus repellendus mollitia officia. Accusantium aspernatur ut aspernatur quia voluptatem quia.,3,Possimus suscipit sunt quia sed exercitationem. Consequatur corrupti quia quos. Quos delectus labore asperiores. In culpa ut explicabo.,Thailand,Rogahn - Hilll,STORAGE,1fd20164-0406-47f4-b6a9-a9894ba7fe04
6e7961e8-31f2-46f1-b8d6-4f4c057205b3,Tasty Cotton Shirt,5288,USD,https://s3.amazonaws.com/uifaces/faces/twitter/unterdreht/128.jpg,Vero a minus et qui aut iste animi eos. Aut officiis officiis qui eos. Animi voluptatem rem quod quos debitis consectetur doloremque ut officia. Rem nihil voluptatem a et aliquam sapiente neque ullam et. Culpa et sequi est. Quia dignissimos distinctio expedita qui facilis debitis similique quia qui.,3,Assumenda nobis id dolor qui. Qui fugit possimus mollitia vero ut. Veritatis non facilis cum eum eum.,Paraguay,Ebert - Purdy,OUT_OF_STOCK,230bba72-4b6b-4974-9b2b-3494ab57a3e6
59370eb0-c862-4219-a261-6b19d6e85500,Ergonomic Concrete Table,9787,USD,https://s3.amazonaws.com/uifaces/faces/twitter/gofrasdesign/128.jpg,Quis architecto veniam esse pariatur. Voluptas laudantium dicta laboriosam vel veritatis sed labore quos qui. Aut dolorem molestiae delectus quia harum illum dolor nostrum. Voluptatem vitae excepturi tenetur et similique ea. Quam voluptatem quia ut mollitia. Aut et accusamus suscipit sint et ab.,1,Quae excepturi ad blanditiis minima culpa dolor. Excepturi laudantium quo rerum. Quis laudantium harum enim harum consequatur consectetur consequuntur fugiat nam. Distinctio et dignissimos voluptatem consequatur. Ut nam magnam totam et.,Norfolk Island,Collins - Moen,OUT_OF_STOCK,230bba72-4b6b-4974-9b2b-3494ab57a3e6
e6236f00-61bc-4fa8-8499-010444603d22,Fantastic Granite Pants,5596,USD,Nemo quos eveniet recusandae. Molestias voluptatibus molestiae quo quidem iure alias corrupti. Doloribus nobis corrupti. Amet magnam voluptas magni enim.,3,Numquam qui eum assumenda. Sit impedit et facilis nisi aut earum aliquam laudantium. Facere doloribus praesentium eos. Esse fugit quam sit aliquam laborum excepturi facere. Qui id itaque.,Trinidad and Tobago,Conn, Lebsack and Baumbach,OK,230bba72-4b6b-4974-9b2b-3494ab57a3e6
728ef49c-6213-485f-8a3c-25ac09aae728,Sleek Wooden Bacon,4107,USD,https://s3.amazonaws.com/uifaces/faces/twitter/tomaslau/128.jpg,Qui voluptatem distinctio ut dolorum voluptatem ut rerum. Sunt unde molestiae non. Velit quia aperiam eaque eveniet aut ut. Dolorum quisquam aspernatur necessitatibus facere dolor qui enim.,2,Ad ipsum amet. Qui et et qui iste est ducimus. Est vitae et reprehenderit dolorum repellendus aut deleniti. Laboriosam ad et omnis. Dolores facilis eaque.,Isle of Man,Kilback, Daugherty and Nader,OUT_OF_STOCK,230bba72-4b6b-4974-9b2b-3494ab57a3e6
1e257663-6dc1-44a0-9199-f4e6441ebf67,Small Cotton Cheese,2653,USD,,Sint eveniet possimus vel nostrum culpa dolor. Officiis esse dolores consectetur reiciendis sit nemo dignissimos. Sapiente iusto sequi sequi magni ut.,2,Ea non error modi perferendis et qui perspiciatis in. Quia facere magnam earum optio ut. Aliquid in enim voluptatem voluptas expedita velit nostrum illo. At voluptatem optio in nesciunt nihil. Ut repellat voluptatem assumenda autem quam. Similique vel ea nemo rerum.,Tuvalu,Fritsch - Swaniawski,OUT_OF_STOCK,230bba72-4b6b-4974-9b2b-3494ab57a3e6
0b02e3e0-3ab7-4d4a-93a1-0d9e94a280a3,Intelligent Wooden Fish,9459,USD,https://s3.amazonaws.com/uifaces/faces/twitter/jmillspaysbills/128.jpg,Necessitatibus qui ipsam qui praesentium alias aut. Numquam omnis placeat veritatis officiis. Et velit quasi quibusdam. Sit consequatur dolorum molestias quaerat. Inventore quaerat magnam ut. Voluptatum ullam nemo natus illo ut consectetur officiis fuga.,3,Repellat tempore officiis. Numquam et ratione omnis voluptate adipisci eos rerum. Dolor nihil vero aut quas possimus nulla odio porro iste.,Saint Kitts and Nevis,Herman LLC,OK,230bba72-4b6b-4974-9b2b-3494ab57a3e6
ae81a918-d6c7-4f52-9d80-62794bfe7857,Small Frozen Salad,9784,EUR,https://s3.amazonaws.com/uifaces/faces/twitter/uxpiper/128.jpg,Et qui sunt quidem vel distinctio voluptatem fuga autem ut. Maiores suscipit omnis nam. Ut omnis nam enim delectus eum. Consequuntur nisi temporibus molestias quas consectetur et quis deserunt.,4,Quos nesciunt vel rerum voluptas et corporis unde vitae velit. Et nulla nesciunt itaque aliquid. Minima adipisci sit. Quisquam mollitia modi eos aliquid sapiente. Sapiente reiciendis praesentium.,Saint Barthelemy,Boyer Group,OK,230bba72-4b6b-4974-9b2b-3494ab57a3e6
775e0c23-ccda-4858-84dd-40b96c121d33,Intelligent Rubber Shirt,4673,USD,https://s3.amazonaws.com/uifaces/faces/twitter/rweve/128.jpg,Aliquam soluta nam nisi. Magni vel fugit est. Sunt nihil nostrum ducimus quae esse in. Quia beatae quidem repellat qui aut est nostrum.,1,Autem quibusdam architecto quia dolores ducimus consequatur sunt autem. Nulla natus eum. Autem aperiam accusantium voluptatem reprehenderit. Explicabo omnis omnis et possimus.,Libyan Arab Jamahiriya,Greenfelder Group,OUT_OF_STOCK,230bba72-4b6b-4974-9b2b-3494ab57a3e6
a65ef802-af32-4364-83c3-27317fdd7a06,Refined Granite Salad,8510,USD,https://s3.amazonaws.com/uifaces/faces/twitter/8d3k/128.jpg,Placeat officiis consequuntur. Quia inventore nihil ea. Molestiae esse id architecto deleniti eius. Quo accusantium temporibus necessitatibus at et amet omnis laborum aut.,3,Mollitia hic cum. Vel dolorum tempora. Est accusamus rerum sit et. Rerum voluptatem et cum doloremque ad reprehenderit qui. Vel quidem exercitationem voluptatum velit dolor dolorem est.,Dominican Republic,Parisian, O'Hara and Lakin,STORAGE,230bba72-4b6b-4974-9b2b-3494ab57a3e6
fe1de2f2-de7a-49e0-a5aa-8fef3d9acd08,Tasty Plastic Bike,3981,EUR,https://s3.amazonaws.com/uifaces/faces/twitter/kirillz/128.jpg,Hic deserunt dolores veritatis ipsam in voluptatem provident. Nihil repellat a autem. Ut et blanditiis quasi asperiores et et velit. Est laudantium et facilis cupiditate sint quaerat excepturi ipsa.,1,Natus saepe quos autem consequatur aut molestias. In voluptatum amet dolorem officiis magnam natus. Harum incidunt quibusdam pariatur eaque perferendis voluptatem tempora omnis. Assumenda dolores accusamus non est ex quidem omnis quia. Ut et consequatur asperiores unde quo debitis dolor. Et ea ut eaque expedita dolorem ipsa.,Cayman Islands,Bartell, Roberts and Bahringer,OK,0b99cf7c-7075-42a1-b01b-a2972209e64d
d462b4ef-0c95-4972-8b68-3b3e10750dcb,Refined Soft Fish,5640,USD,https://s3.amazonaws.com/uifaces/faces/twitter/mufaddal_mw/128.jpg,Et sed odio nostrum dolores. Et mollitia inventore nam libero tempore harum unde vero. Laudantium ipsa blanditiis aspernatur corporis. Quos repudiandae ea corporis reprehenderit sed.,1,Enim error nemo quibusdam non exercitationem accusamus. Et inventore amet ut non eaque. Ad ducimus et explicabo excepturi eligendi autem harum. Quam aut dolores autem occaecati provident. Quia qui voluptatem ipsa atque soluta voluptatem.,Lithuania,Kling - Carroll,OUT_OF_STOCK,18da6328-d816-4e95-a736-70b67953c59c
78d65ddd-6f75-4301-8d70-6a922de60ffa,Incredible Cotton Chips,3534,EUR,https://s3.amazonaws.com/uifaces/faces/twitter/raquelwilson/128.jpg,Repellendus ut est eius excepturi rerum sed. Officiis consectetur facere ratione. Soluta eius enim iure quas. Doloribus perferendis quia fugiat dignissimos cumque.,5,Vel excepturi qui commodi mollitia soluta dolor magnam. Ut neque sint consequatur. Cupiditate quibusdam maiores fuga optio non a.,Virgin Islands, U.S.,Christiansen, Morar and Koss,OUT_OF_STOCK,18da6328-d816-4e95-a736-70b67953c59c
3d5457ec-1438-4acb-b626-558fcd5eee63,Incredible Cotton Mouse,7739,EUR,https://s3.amazonaws.com/uifaces/faces/twitter/_dwite_/128.jpg,Nisi eum eveniet quidem eaque illum omnis et. Sint doloribus earum voluptate molestiae qui omnis quas. Tempore optio aut sequi nihil exercitationem quae vero quia.,2,Sint et enim natus libero aut ullam necessitatibus. Tempora omnis quis facilis et voluptas et recusandae possimus. Similique ducimus aut amet voluptate reiciendis adipisci quidem nostrum id. Ut animi exercitationem quisquam tempore architecto odio. Enim ut non amet quaerat assumenda.,Poland,Ledner - Altenwerth,OUT_OF_STOCK,230bba72-4b6b-4974-9b2b-3494ab57a3e6
d0d9792e-11ed-4c0c-ac2e-080650f09d08,Unbranded Granite Soap,2149,USD,https://s3.amazonaws.com/uifaces/faces/twitter/AM_Kn2/128.jpg,Earum unde et quidem et sint deserunt delectus. Ducimus saepe modi id eius molestias nulla dolorem. Ipsa delectus quidem dolores. Qui in eum omnis velit et iste dolor odio. Nisi alias ipsam facere nihil inventore adipisci harum et recusandae.,5,Amet dolor dicta voluptatem maiores est. Omnis magnam officiis eaque. Est est quae reprehenderit rerum natus ab. Reprehenderit accusantium necessitatibus. Natus voluptatem molestiae explicabo blanditiis qui.,Equatorial Guinea,Lindgren - Grady,STORAGE,230bba72-4b6b-4974-9b2b-3494ab57a3e6
2107494e-2898-49d6-b4d0-b52384705ef6,Gorgeous Frozen Cheese,1749,USD,https://s3.amazonaws.com/uifaces/faces/twitter/chrisslowik/128.jpg,Atque ipsa mollitia voluptatem. Alias deleniti saepe quas occaecati ut. Doloribus fugiat consequatur reiciendis qui a et maxime. Recusandae consectetur dolorum necessitatibus. Explicabo dolor dolores rerum iusto fugit dolores eaque.,4,Voluptatem et voluptate dolorum tempora in sit consequatur provident omnis. Occaecati qui dolorem. Nihil dolore pariatur et est qui. Alias ut ipsum totam ea quo nesciunt. Ullam tempore et dolorum sed commodi consequuntur dolor.,Nauru,Veum and Sons,OUT_OF_STOCK,480c81bb-b525-40a3-aa03-c49148386515
b535b7b8-1ce6-4d82-8b46-7e1bab48e626,Handmade Granite Computer,7103,USD,https://s3.amazonaws.com/uifaces/faces/twitter/juaumlol/128.jpg,Provident ex eos in et dolore. Et quam velit eius sed dolores ut voluptatem nihil quas. Optio minus voluptatibus quam. Expedita nobis voluptatem neque. Ipsam quod non totam.,3,Quisquam dolores qui doloribus facere. Nulla quod exercitationem. Occaecati corporis voluptatibus cumque autem maxime sapiente voluptas. Voluptatum asperiores ut ut repudiandae perferendis hic sed voluptas dignissimos. Distinctio exercitationem eos recusandae ad. Voluptates maxime odit autem enim et sunt ipsum id.,Falkland Islands (Malvinas),Dickens - Tromp,OUT_OF_STOCK,0b99cf7c-7075-42a1-b01b-a2972209e64d
1886a80f-9694-4f09-bde7-c99014574710,Licensed Frozen Tuna,1320,USD,https://s3.amazonaws.com/uifaces/faces/twitter/ajaxy_ru/128.jpg,Non expedita tempore ipsam dolore iste. Nam laborum velit amet. Voluptatum ad aut totam dolorem quod possimus ab atque quia. Possimus incidunt voluptatem sint explicabo aliquid aut.,5,Sapiente nulla repellendus cumque atque. Sunt aut et et enim omnis qui voluptatibus. Similique illo architecto odit aut laudantium sint iusto vero.,Dominican Republic,Cremin, Kertzmann and McLaughlin,STORAGE,18da6328-d816-4e95-a736-70b67953c59c
0ea1c84e-4abe-4171-976f-d3310c4206ff,Generic Steel Soap,9811,USD,https://s3.amazonaws.com/uifaces/faces/twitter/kanickairaj/128.jpg,Consequatur libero delectus quos aut est. Deserunt esse quaerat pariatur voluptatem. Ratione necessitatibus quos velit dicta non nihil aut.,5,Officiis in est harum. Pariatur sunt maxime eligendi dolorem sunt. Labore aut ipsa.,Senegal,Mann, Gerhold and Carroll,OUT_OF_STOCK,480c81bb-b525-40a3-aa03-c49148386515
d3270e9e-fabc-4b33-8416-d5716ab25612,Handcrafted Frozen Chicken,1146,USD,https://s3.amazonaws.com/uifaces/faces/twitter/bungiwan/128.jpg,Blanditiis cumque debitis omnis praesentium officiis quaerat rerum omnis voluptatem. Eligendi vitae in mollitia ut atque soluta voluptatem quia nisi. Voluptatem ullam sapiente tempore. Est unde laborum hic tenetur.,3,Alias aut provident ab quam veritatis rem. Deserunt reprehenderit ea qui in hic minima. Officiis nihil repellendus commodi culpa sunt. Accusantium perspiciatis eaque quia dolorum sint vitae eligendi et.,Saudi Arabia,Lakin - Swift,STORAGE,0b99cf7c-7075-42a1-b01b-a2972209e64d
4e919d2f-1c07-416b-b6da-de5cf6d64f7c,Refined Plastic Table,6468,USD,,Non omnis ad unde harum. Molestiae incidunt vitae officia pariatur sed aliquid voluptatum. Et incidunt quia voluptas neque omnis doloremque.,5,Cum autem est autem repellat dolor. A non incidunt dolor vero sed. Voluptatem voluptas qui.,Greenland,Koelpin Inc,OK,18da6328-d816-4e95-a736-70b67953c59c
4f9f5a41-4e6a-43d8-acbe-db888b8e47ca,Incredible Frozen Cheese,6286,USD,https://s3.amazonaws.com/uifaces/faces/twitter/mslarkina/128.jpg,Et voluptatibus enim voluptatum dolorum non necessitatibus blanditiis nesciunt. Vel ab qui non ut incidunt. Iusto cum optio veritatis laborum quaerat iste. Quaerat sit porro debitis consequuntur ducimus sapiente quam. Consequatur eum perferendis et aut. Minus dolor non iure iste quia.,1,Quo eum a tempora molestias. Consequatur maiores quaerat. Sunt occaecati voluptas doloribus voluptatibus expedita est.,Croatia,Abshire and Sons,STORAGE,480c81bb-b525-40a3-aa03-c49148386515
0c2a979b-f93f-4294-a7a7-1957040d3d13,Practical Cotton Shoes,4689,EUR,https://s3.amazonaws.com/uifaces/faces/twitter/andrewofficer/128.jpg,Cupiditate est voluptatem consequatur animi officia est voluptatem dignissimos minima. Mollitia dolorem aliquid totam aut nostrum. Asperiores numquam sapiente quia ipsam quaerat in necessitatibus expedita dolore. Dolor numquam eum.,5,Cumque exercitationem est nostrum eum cupiditate reiciendis voluptatem voluptatem. Mollitia id esse. Provident vero voluptas. Magni vero provident ut voluptates voluptatibus nihil cupiditate. Quia quibusdam quisquam eos dolor omnis animi. Corporis saepe ducimus quia cumque.,Guernsey,Hilll, Cartwright and Lemke,STORAGE,0b99cf7c-7075-42a1-b01b-a2972209e64d
166d4ff8-5550-4a56-962b-e9113d8ab13e,Intelligent Concrete Cheese,2898,UER,https://s3.amazonaws.com/uifaces/faces/twitter/doooon/128.jpg,Maxime quam et rem. Quasi nobis qui enim possimus libero. Ducimus illum est totam. Qui laudantium possimus nisi neque unde ducimus commodi omnis consectetur.,3,Ut vitae aperiam aliquid harum non quod. Porro ad et non fugit. Labore ipsam quo dicta eveniet laboriosam voluptas. Vitae voluptatem doloribus cupiditate non et aut. Neque est distinctio iusto cumque eos. Cumque aliquam in aut inventore laborum nemo nihil.,Malawi,Aufderhar and Sons,OUT_OF_STOCK,480c81bb-b525-40a3-aa03-c49148386515
